{
  "$schema": "../schema.chain.json",
  "prefix": "wormhole",
  "gasPriceStep": {
    "low": "0",
    "average": "0",
    "high": "0"
  },
  "bip44": {
    "coinType": "118"
  },
  "configurations": [
    {
      "chainId": "wormchain",
      "chainName": "Wormhole Gateway",
      "identifier": "wormhole",
      "rpc": ["https://wormchain-rpc.quickapi.com:443"],
      "rest": [
        "https://wormchain-lcd.quickapi.com",
        "https://tncnt-eu-wormchain-main-01.rpc.p2p.world/lcd"
      ],
      "jrpc": [
        "https://wormchain-rpc.quickapi.com",
        "https://tncnt-eu-wormchain-main-01.rpc.p2p.world",
        "https://wormchain.jumpisolated.com"
      ],
      "clientId": "07-tendermint-119",
      "currencies": [
        {
          "coinDenom": "WORM",
          "coinMinDenom": "uworm",
          "coinDecimals": "6"
        }
      ],
      "source": {
        "sourceChannel": "channel-94",
        "sourceIBCDenomToEvmos": " ",
        "destinationChannel": "channel-5",
        "jsonRPC": ["https://wormchain-rpc.quickapi.com:443"]
      },
      "configurationType": "mainnet",
      "explorerTxUrl": "https://bigdipper.live/wormhole/transactions",
      "img": {
        "svg": "https://raw.githubusercontent.com/evmos/chain-token-registry/main/assets/chainConfig/wormhole.svg",
        "png": "https://raw.githubusercontent.com/evmos/chain-token-registry/main/assets/chainConfig/wormhole.png"
      },
      "cosmosRegistryUrl": "https://raw.githubusercontent.com/cosmos/chain-registry/master/gateway/chain.json"
    }
  ]
}
